{
  "schema": "promtech.audit-state/1",
  "last_attempt": {
    "run_id": "20261015T203240Z-569a",
    "started_at": "2026-10-15T20:32:40Z",
    "status": "COMPLETED",
    "stage": "done",
    "finished_at": "2026-10-15T20:33:43Z",
    "exit_code": 0
  },
  "last_observed": {
    "source_ref": "8d275a12ff826a9646c9abe092fe3c11eee4e81f",
    "target_ref": "abcf10ba215e9f33a68a194cf3c9d0917b0d5b7e",
    "at": "2026-10-15T20:32:40Z"
  },
  "last_reported": {
    "run_id": "20261015T203240Z-569a",
    "source_ref": "8d275a12ff826a9646c9abe092fe3c11eee4e81f",
    "source_blob": "52454ddc153e66f17bd1a629276663af91c082ab",
    "target_ref": "abcf10ba215e9f33a68a194cf3c9d0917b0d5b7e",
    "logical_key": "6b0432588bdf3341",
    "local_date": "2026-10-16",
    "completed_at": "2026-10-15T20:33:43Z",
    "report": "daily/2026-10-16/20261015T203240Z-569a.md",
    "artifact_sha256": "23f7589a757362bbe29bf7970e34c101b671170a2b7e0f3bf047386205516482",
    "check_ids": [
      "HAR-COVERAGE",
      "HAR-JOURNAL",
      "HAR-SECRETS",
      "SRC-ACCEPTED",
      "SRC-CASE",
      "SRC-DIFF",
      "SRC-FETCH",
      "SRC-HISTORY",
      "SRC-INVENTORY",
      "SRC-PATH",
      "SRC-PIN",
      "SRC-SYNTAX",
      "SRC-WATCHED",
      "TASKS-READ",
      "TASKS-WRITE",
      "TGT-BACKUP",
      "TGT-BUILD",
      "TGT-DB",
      "TGT-DEPS",
      "TGT-HTTP",
      "TGT-MIGRATE",
      "TGT-PINT",
      "TGT-REF",
      "TGT-TESTS",
      "TGT-TYPES"
    ],
    "tests": [
      "Tests\\Feature\\Access\\ChannelScopeTest::test_directory_holds_the_eight_legacy_channels_in_order",
      "Tests\\Feature\\Access\\ChannelScopeTest::test_every_role_channel_exists_and_unknown_channels_are_rejected",
      "Tests\\Feature\\Access\\ChannelScopeTest::test_filter_follows_legacy_get_channel_filter",
      "Tests\\Feature\\Access\\ChannelScopeTest::test_queries_return_only_the_channels_a_user_may_see",
      "Tests\\Feature\\Access\\PageAccessTest::test_director_menu_has_21_pages_and_no_techcards",
      "Tests\\Feature\\Access\\PageAccessTest::test_guest_cannot_open_any_page",
      "Tests\\Feature\\Access\\PageAccessTest::test_inactive_user_loses_access_immediately",
      "Tests\\Feature\\Access\\PageAccessTest::test_menu_shows_exactly_the_allowed_pages with data set \"accountant\"",
      "Tests\\Feature\\Access\\PageAccessTest::test_menu_shows_exactly_the_allowed_pages with data set \"buyer\"",
      "Tests\\Feature\\Access\\PageAccessTest::test_menu_shows_exactly_the_allowed_pages with data set \"dealer_aktau\"",
      "Tests\\Feature\\Access\\PageAccessTest::test_menu_shows_exactly_the_allowed_pages with data set \"dealer_aktobe\"",
      "Tests\\Feature\\Access\\PageAccessTest::test_menu_shows_exactly_the_allowed_pages with data set \"dealer_astana\"",
      "Tests\\Feature\\Access\\PageAccessTest::test_menu_shows_exactly_the_allowed_pages with data set \"dealer_atyrau\"",
      "Tests\\Feature\\Access\\PageAccessTest::test_menu_shows_exactly_the_allowed_pages with data set \"dealer_shymkent\"",
      "Tests\\Feature\\Access\\PageAccessTest::test_menu_shows_exactly_the_allowed_pages with data set \"director\"",
      "Tests\\Feature\\Access\\PageAccessTest::test_menu_shows_exactly_the_allowed_pages with data set \"foreman\"",
      "Tests\\Feature\\Access\\PageAccessTest::test_menu_shows_exactly_the_allowed_pages with data set \"hr\"",
      "Tests\\Feature\\Access\\PageAccessTest::test_menu_shows_exactly_the_allowed_pages with data set \"manager\"",
      "Tests\\Feature\\Access\\PageAccessTest::test_menu_shows_exactly_the_allowed_pages with data set \"salon_armada\"",
      "Tests\\Feature\\Access\\PageAccessTest::test_menu_shows_exactly_the_allowed_pages with data set \"salon_armada_mgr\"",
      "Tests\\Feature\\Access\\PageAccessTest::test_menu_shows_exactly_the_allowed_pages with data set \"salon_nazarbayeva\"",
      "Tests\\Feature\\Access\\PageAccessTest::test_menu_shows_exactly_the_allowed_pages with data set \"storekeeper\"",
      "Tests\\Feature\\Access\\PageAccessTest::test_role_reaches_exactly_its_pages with data set \"accountant\"",
      "Tests\\Feature\\Access\\PageAccessTest::test_role_reaches_exactly_its_pages with data set \"buyer\"",
      "Tests\\Feature\\Access\\PageAccessTest::test_role_reaches_exactly_its_pages with data set \"dealer_aktau\"",
      "Tests\\Feature\\Access\\PageAccessTest::test_role_reaches_exactly_its_pages with data set \"dealer_aktobe\"",
      "Tests\\Feature\\Access\\PageAccessTest::test_role_reaches_exactly_its_pages with data set \"dealer_astana\"",
      "Tests\\Feature\\Access\\PageAccessTest::test_role_reaches_exactly_its_pages with data set \"dealer_atyrau\"",
      "Tests\\Feature\\Access\\PageAccessTest::test_role_reaches_exactly_its_pages with data set \"dealer_shymkent\"",
      "Tests\\Feature\\Access\\PageAccessTest::test_role_reaches_exactly_its_pages with data set \"director\"",
      "Tests\\Feature\\Access\\PageAccessTest::test_role_reaches_exactly_its_pages with data set \"foreman\"",
      "Tests\\Feature\\Access\\PageAccessTest::test_role_reaches_exactly_its_pages with data set \"hr\"",
      "Tests\\Feature\\Access\\PageAccessTest::test_role_reaches_exactly_its_pages with data set \"manager\"",
      "Tests\\Feature\\Access\\PageAccessTest::test_role_reaches_exactly_its_pages with data set \"salon_armada\"",
      "Tests\\Feature\\Access\\PageAccessTest::test_role_reaches_exactly_its_pages with data set \"salon_armada_mgr\"",
      "Tests\\Feature\\Access\\PageAccessTest::test_role_reaches_exactly_its_pages with data set \"salon_nazarbayeva\"",
      "Tests\\Feature\\Access\\PageAccessTest::test_role_reaches_exactly_its_pages with data set \"storekeeper\"",
      "Tests\\Feature\\Access\\PageAccessTest::test_shared_props_carry_no_credentials",
      "Tests\\Feature\\Auth\\LoginTest::test_after_logout_the_server_refuses_changes",
      "Tests\\Feature\\Auth\\LoginTest::test_empty_login_or_password_shows_legacy_message",
      "Tests\\Feature\\Auth\\LoginTest::test_first_page_follows_role_template",
      "Tests\\Feature\\Auth\\LoginTest::test_inactive_user_cannot_sign_in",
      "Tests\\Feature\\Auth\\LoginTest::test_login_is_trimmed_and_case_insensitive_like_legacy",
      "Tests\\Feature\\Auth\\LoginTest::test_login_page_never_contains_credentials",
      "Tests\\Feature\\Auth\\LoginTest::test_pin_sign_in_is_not_available_until_employees_are_migrated",
      "Tests\\Feature\\Auth\\LoginTest::test_repeated_failures_are_throttled",
      "Tests\\Feature\\Catalog\\ProductTest::test_author_edits_own_product_others_only_mark_it_for_deletion",
      "Tests\\Feature\\Catalog\\ProductTest::test_concurrent_edit_is_rejected",
      "Tests\\Feature\\Catalog\\ProductTest::test_created_product_keeps_exact_prices_and_author_after_reload",
      "Tests\\Feature\\Catalog\\ProductTest::test_director_edits_any_product_and_product_without_author_is_editable",
      "Tests\\Feature\\Catalog\\ProductTest::test_only_director_or_accountant_deletes_and_deleted_product_does_not_return",
      "Tests\\Feature\\Catalog\\ProductTest::test_order_follows_legacy_database_not_byte_order",
      "Tests\\Feature\\Catalog\\ProductTest::test_page_lists_active_products_with_rights",
      "Tests\\Feature\\Catalog\\ProductTest::test_roles_without_catalog_cannot_read_or_write",
      "Tests\\Feature\\Catalog\\ProductTest::test_validation_messages_repeat_legacy_texts",
      "Tests\\Feature\\Crm\\CrmTaskTest::test_a_task_about_a_lead_follows_the_lead_channel",
      "Tests\\Feature\\Crm\\CrmTaskTest::test_checkbox_marks_done_and_reopens_and_delete_hides_the_task",
      "Tests\\Feature\\Crm\\CrmTaskTest::test_form_creates_and_edits_a_task",
      "Tests\\Feature\\Crm\\CrmTaskTest::test_roles_without_crm_cannot_reach_tasks",
      "Tests\\Feature\\Crm\\LeadCommunicationTest::test_entries_are_added_listed_and_deleted",
      "Tests\\Feature\\Crm\\LeadCommunicationTest::test_history_of_another_channel_is_not_reachable",
      "Tests\\Feature\\Crm\\LeadTest::test_clients_tab_counts_salon_end_clients_and_loads_their_orders_with_the_tab",
      "Tests\\Feature\\Crm\\LeadTest::test_dealer_and_head_of_the_shop_see_only_projects",
      "Tests\\Feature\\Crm\\LeadTest::test_deleted_lead_leaves_the_lists",
      "Tests\\Feature\\Crm\\LeadTest::test_funnel_form_keeps_segment_tags_and_the_next_action",
      "Tests\\Feature\\Crm\\LeadTest::test_lead_becomes_a_client_of_its_channel_and_is_won",
      "Tests\\Feature\\Crm\\LeadTest::test_leads_follow_the_channel_scope",
      "Tests\\Feature\\Crm\\LeadTest::test_leads_form_creates_and_edits_a_lead",
      "Tests\\Feature\\Crm\\LeadTest::test_order_boards_load_the_orders_that_are_not_cancelled",
      "Tests\\Feature\\Crm\\LeadTest::test_page_lists_leads_newest_first_with_the_legacy_dictionaries",
      "Tests\\Feature\\Crm\\LeadTest::test_roles_without_crm_cannot_reach_leads",
      "Tests\\Feature\\Crm\\LeadTest::test_salons_manager_cannot_create_a_lead_without_a_salon",
      "Tests\\Feature\\Crm\\LeadTest::test_second_editor_gets_a_conflict",
      "Tests\\Feature\\Crm\\LeadTest::test_status_moves_and_lost_reason_is_added_to_the_comment",
      "Tests\\Feature\\Crm\\ProjectTest::test_calculation_versions_totals_and_status",
      "Tests\\Feature\\Crm\\ProjectTest::test_customer_decides_on_a_sent_calculation_only",
      "Tests\\Feature\\Crm\\ProjectTest::test_executors_are_staff_users",
      "Tests\\Feature\\Crm\\ProjectTest::test_files_sides_downloads_and_deleting",
      "Tests\\Feature\\Crm\\ProjectTest::test_head_changes_follow_the_rights_and_the_record_version",
      "Tests\\Feature\\Crm\\ProjectTest::test_only_the_director_deletes_a_project_and_it_is_kept_deactivated",
      "Tests\\Feature\\Crm\\ProjectTest::test_open_projects_are_counted_and_staff_get_the_executor_list",
      "Tests\\Feature\\Crm\\ProjectTest::test_projects_follow_the_channel_and_the_customer_does_not_get_costs_drafts_or_internal_things",